{
  "risk_level": "confirm",
  "decision": "allow",
  "authorizers": [
    {
      "authorizer_id": "alice-iphone",
      "authorizer_pubkey": "ed25519:zyxwvutsrqponmlkjihgfedcba765432zyxwvutsrqponmlkjihg",
      "modality_used": "touch_id",
      "decided_at": "2026-06-25T12:00:08Z",
      "decision": "allow"
    }
  ],
  "modalities_used": ["touch_id"],
  "bypass_active": false,
  "action_summary": "DROP TABLE prod_logs",
  "granted_at": "2026-06-25T12:00:08Z",
  "expires_at": "2026-06-25T12:05:08Z"
}
